{"algorithm": [6, "/categories/algorithm/", {"posts": [{"date": "03/20/2017", "isodate": "2017-03-20T00:30:58+08:00", "title": "Interesting Projects in Google Summer of Code 2017", "url": "/posts/interesting-projects-in-google-summer-of-code-2017/"}, {"date": "02/10/2017", "isodate": "2017-02-10T13:59:56+08:00", "title": "Approximation Error of Position", "url": "/posts/approximation-error-of-position/"}, {"date": "07/24/2016", "isodate": "2016-07-24T14:11:59+08:00", "title": "Tool Tips", "url": "/notes/tool-tips/"}, {"date": "07/20/2016", "isodate": "2016-07-20T13:30:46+08:00", "title": "Wrap Angle to Given Range", "url": "/posts/wrap-angle-to-given-range/"}, {"date": "06/28/2016", "isodate": "2016-06-28T10:04:59+08:00", "title": "Arc Length Reparameterization", "url": "/posts/arc-length-reparameterization/"}, {"date": "05/26/2016", "isodate": "2016-05-26T14:23:42+08:00", "title": "Clothoid Approximation", "url": "/posts/clothoid-approximation/"}, {"date": "04/26/2016", "isodate": "2016-04-26T01:34:15+08:00", "title": "Angle between 2 Vectors", "url": "/posts/angle-between-2-vectors/"}]}], "atom": [2, "/categories/atom/", {"posts": [{"date": "04/25/2016", "isodate": "2016-04-25T12:22:10+08:00", "title": "Atom Markdown Settings", "url": "/posts/atom-markdown-settings/"}, {"date": "04/25/2016", "isodate": "2016-04-25T12:21:47+08:00", "title": "Atom LaTeX Settings", "url": "/posts/atom-latex-settings/"}]}], "clojure": [1, "/categories/clojure/", {"posts": [{"date": "04/25/2016", "isodate": "2016-04-25T12:22:27+08:00", "title": "Build Github Pages with Cryogen", "url": "/posts/build-github-pages-with-cryogen/"}]}], "clothoid": [2, "/categories/clothoid/", {"posts": [{"date": "02/10/2017", "isodate": "2017-02-10T13:59:56+08:00", "title": "Approximation Error of Position", "url": "/posts/approximation-error-of-position/"}, {"date": "05/26/2016", "isodate": "2016-05-26T14:23:42+08:00", "title": "Clothoid Approximation", "url": "/posts/clothoid-approximation/"}]}], "cpp": [3, "/categories/cpp/", {"posts": [{"date": "07/20/2016", "isodate": "2016-07-20T13:30:46+08:00", "title": "Wrap Angle to Given Range", "url": "/posts/wrap-angle-to-given-range/"}, {"date": "04/26/2016", "isodate": "2016-04-26T01:17:23+08:00", "title": "Install MonoDevelop on Ubuntu", "url": "/posts/install-monodevelop-on-ubuntu/"}, {"date": "04/26/2016", "isodate": "2016-04-26T01:04:11+08:00", "title": "Visual Studio Auto Formatting Shortcut", "url": "/posts/visual-studio-auto-formatting-shortcut/"}]}], "domain": [4, "/categories/domain/", {"posts": [{"date": "08/17/2016", "isodate": "2016-08-17T02:16:12+08:00", "title": "\u514d\u8d39\u57df\u540d\u90ae\u7bb1\u9009\u62e9", "url": "/posts/mian-fei-yu-ming-you-xiang-xuan-ze/"}, {"date": "05/29/2016", "isodate": "2016-05-29T01:18:51+08:00", "title": "Alexa \u524d100\u4e07\u7f51\u7ad9\u57df\u540d\u540e\u7f00\u7edf\u8ba1", "url": "/posts/alexa-qian-100-wan-wang-zhan-yu-ming-hou-zhui-tong-ji/"}, {"date": "05/16/2016", "isodate": "2016-05-16T12:52:40+08:00", "title": "\u57df\u540d\u76f8\u5173\u5e38\u8bc6", "url": "/posts/yu-ming-xiang-guan-chang-shi/"}, {"date": "05/06/2016", "isodate": "2016-05-06T14:04:20+08:00", "title": "Custom Domain Settings of Yandex Mail", "url": "/posts/custom-domain-settings-of-yandex-mail/"}]}], "emacs": [3, "/categories/emacs/", {"posts": [{"date": "04/25/2016", "isodate": "2016-04-25T12:24:11+08:00", "title": "Org-Mode PDF Export in Chinese", "url": "/posts/org-mode-pdf-export-in-chinese/"}, {"date": "04/25/2016", "isodate": "2016-04-25T12:23:49+08:00", "title": "Spacemacs Learning Notes", "url": "/posts/spacemacs-learning-notes/"}, {"date": "04/25/2016", "isodate": "2016-04-25T12:23:26+08:00", "title": "Org-Mode Learning Notes", "url": "/posts/org-mode-learning-notes/"}]}], "email": [1, "/categories/email/", {"posts": [{"date": "08/17/2016", "isodate": "2016-08-17T02:16:12+08:00", "title": "\u514d\u8d39\u57df\u540d\u90ae\u7bb1\u9009\u62e9", "url": "/posts/mian-fei-yu-ming-you-xiang-xuan-ze/"}]}], "git": [1, "/categories/git/", {"posts": [{"date": "04/25/2016", "isodate": "2016-04-25T16:07:58+08:00", "title": "Git Learning Notes", "url": "/posts/git-learning-notes/"}]}], "github": [4, "/categories/github/", {"posts": [{"date": "08/23/2016", "isodate": "2016-08-23T11:41:45+08:00", "title": "\u5173\u4e8eGitHub\u7684\u4f7f\u7528\u601d\u8003", "url": "/posts/guan-yu-github-de-shi-yong-si-kao/"}, {"date": "04/26/2016", "isodate": "2016-04-26T12:56:35+08:00", "title": "Build Github Pages with Nikola", "url": "/posts/build-github-pages-with-nikola/"}, {"date": "04/25/2016", "isodate": "2016-04-25T16:07:58+08:00", "title": "Git Learning Notes", "url": "/posts/git-learning-notes/"}, {"date": "04/25/2016", "isodate": "2016-04-25T12:22:27+08:00", "title": "Build Github Pages with Cryogen", "url": "/posts/build-github-pages-with-cryogen/"}]}], "inkscape": [1, "/categories/inkscape/", {"posts": [{"date": "04/25/2016", "isodate": "2016-04-25T21:45:44+08:00", "title": "Install Textext Plugin for Inkscape", "url": "/posts/install-textext-plugin-for-inkscape/"}]}], "julia": [6, "/categories/julia/", {"posts": [{"date": "03/20/2017", "isodate": "2017-03-20T00:30:58+08:00", "title": "Interesting Projects in Google Summer of Code 2017", "url": "/posts/interesting-projects-in-google-summer-of-code-2017/"}, {"date": "03/19/2017", "isodate": "2017-03-19T13:04:52+08:00", "title": "IJulia Installation Failed", "url": "/posts/ijulia-installation-failed/"}, {"date": "03/18/2017", "isodate": "2017-03-18T09:05:10+08:00", "title": "Julia Packages", "url": "/posts/julia-packages/"}, {"date": "03/01/2017", "isodate": "2017-03-01T13:59:43+08:00", "title": "Julia for Matrix Methods", "url": "/posts/julia-for-matrix-methods/"}, {"date": "07/20/2016", "isodate": "2016-07-20T13:30:46+08:00", "title": "Wrap Angle to Given Range", "url": "/posts/wrap-angle-to-given-range/"}, {"date": "05/24/2016", "isodate": "2016-05-24T12:22:41+08:00", "title": "Julia Notes", "url": "/posts/julia-notes/"}]}], "latex": [3, "/categories/latex/", {"posts": [{"date": "04/25/2016", "isodate": "2016-04-25T21:45:44+08:00", "title": "Install Textext Plugin for Inkscape", "url": "/posts/install-textext-plugin-for-inkscape/"}, {"date": "04/25/2016", "isodate": "2016-04-25T12:22:49+08:00", "title": "LyX Settins on Windows", "url": "/posts/lyx-settins-on-windows/"}, {"date": "04/25/2016", "isodate": "2016-04-25T12:21:47+08:00", "title": "Atom LaTeX Settings", "url": "/posts/atom-latex-settings/"}]}], "markdown": [1, "/categories/markdown/", {"posts": [{"date": "04/25/2016", "isodate": "2016-04-25T12:22:10+08:00", "title": "Atom Markdown Settings", "url": "/posts/atom-markdown-settings/"}]}], "matlab": [1, "/categories/matlab/", {"posts": [{"date": "05/25/2016", "isodate": "2016-05-25T20:02:10+08:00", "title": "Matlab 3D Plot", "url": "/posts/matlab-3d-plot/"}]}], "nikola": [2, "/categories/nikola/", {"posts": [{"date": "02/12/2017", "isodate": "2017-02-12T21:06:35+08:00", "title": "reStructuredText Notes", "url": "/posts/reStructuredText-notes/"}, {"date": "04/26/2016", "isodate": "2016-04-26T12:56:35+08:00", "title": "Build Github Pages with Nikola", "url": "/posts/build-github-pages-with-nikola/"}]}], "org-mode": [3, "/categories/org-mode/", {"posts": [{"date": "04/25/2016", "isodate": "2016-04-25T18:43:39+08:00", "title": "Org to rst Notes", "url": "/posts/org-to-rst-notes/"}, {"date": "04/25/2016", "isodate": "2016-04-25T12:24:11+08:00", "title": "Org-Mode PDF Export in Chinese", "url": "/posts/org-mode-pdf-export-in-chinese/"}, {"date": "04/25/2016", "isodate": "2016-04-25T12:23:26+08:00", "title": "Org-Mode Learning Notes", "url": "/posts/org-mode-learning-notes/"}]}], "project": [1, "/categories/project/", {"posts": [{"date": "03/20/2017", "isodate": "2017-03-20T00:30:58+08:00", "title": "Interesting Projects in Google Summer of Code 2017", "url": "/posts/interesting-projects-in-google-summer-of-code-2017/"}]}], "python": [2, "/categories/python/", {"posts": [{"date": "02/12/2017", "isodate": "2017-02-12T21:06:35+08:00", "title": "reStructuredText Notes", "url": "/posts/reStructuredText-notes/"}, {"date": "04/26/2016", "isodate": "2016-04-26T12:56:35+08:00", "title": "Build Github Pages with Nikola", "url": "/posts/build-github-pages-with-nikola/"}]}], "sage": [1, "/categories/sage/", {"posts": [{"date": "04/25/2016", "isodate": "2016-04-25T21:09:20+08:00", "title": "SageMath File Exchange with Windows via VirtualBox", "url": "/posts/sagemath-file-exchange-with-windows-via-virtualbox/"}]}], "text-editor": [1, "/categories/text-editor/", {"posts": [{"date": "04/25/2016", "isodate": "2016-04-25T12:23:01+08:00", "title": "Notepad++ Tips", "url": "/posts/notepad%2B%2B-tips/"}]}], "tutorial": [1, "/categories/tutorial/", {"posts": [{"date": "03/01/2017", "isodate": "2017-03-01T13:59:43+08:00", "title": "Julia for Matrix Methods", "url": "/posts/julia-for-matrix-methods/"}]}], "ubuntu": [1, "/categories/ubuntu/", {"posts": [{"date": "08/18/2016", "isodate": "2016-08-18T12:22:35+08:00", "title": "\u91cd\u7f6eUbuntu\u767b\u5f55\u5bc6\u7801", "url": "/posts/chong-zhi-ubuntu-deng-lu-mi-ma/"}]}], "visual-studio": [1, "/categories/visual-studio/", {"posts": [{"date": "04/26/2016", "isodate": "2016-04-26T01:04:11+08:00", "title": "Visual Studio Auto Formatting Shortcut", "url": "/posts/visual-studio-auto-formatting-shortcut/"}]}], "web": [4, "/categories/web/", {"posts": [{"date": "07/24/2016", "isodate": "2016-07-24T14:11:59+08:00", "title": "Tool Tips", "url": "/notes/tool-tips/"}, {"date": "05/29/2016", "isodate": "2016-05-29T01:18:51+08:00", "title": "Alexa \u524d100\u4e07\u7f51\u7ad9\u57df\u540d\u540e\u7f00\u7edf\u8ba1", "url": "/posts/alexa-qian-100-wan-wang-zhan-yu-ming-hou-zhui-tong-ji/"}, {"date": "04/26/2016", "isodate": "2016-04-26T12:56:35+08:00", "title": "Build Github Pages with Nikola", "url": "/posts/build-github-pages-with-nikola/"}, {"date": "04/25/2016", "isodate": "2016-04-25T18:43:39+08:00", "title": "Org to rst Notes", "url": "/posts/org-to-rst-notes/"}, {"date": "04/25/2016", "isodate": "2016-04-25T12:22:27+08:00", "title": "Build Github Pages with Cryogen", "url": "/posts/build-github-pages-with-cryogen/"}]}], "\u624b\u673a": [1, "/categories/shou-ji/", {"posts": [{"date": "02/09/2017", "isodate": "2017-02-09T14:51:43+08:00", "title": "\u5c0f\u7c73\u624b\u673a\u8fde\u63a5\u7535\u8111", "url": "/posts/xiao-mi-shou-ji-lian-jie-dian-nao/"}]}], "\u653f\u6cbb": [1, "/categories/zheng-zhi/", {"posts": [{"date": "05/01/2016", "isodate": "2016-05-01T20:11:55+08:00", "title": "Hunger Games \u89c2\u540e\u611f", "url": "/posts/hunger-games-guan-hou-gan/"}]}], "\u6545\u4e8b": [1, "/categories/gu-shi/", {"posts": [{"date": "06/15/2016", "isodate": "2016-06-15T15:09:52+08:00", "title": "\u6536\u7334\u5b50\u5356\u7334\u5b50\u7684\u6545\u4e8b(\u52a0\u5f3a\u7248)", "url": "/posts/shou-hou-zi-mai-hou-zi-de-gu-shi-jia-qiang-ban/"}]}], "\u6587\u5b66": [1, "/categories/wen-xue/", {"posts": [{"date": "07/09/2016", "isodate": "2016-07-09T19:23:43+08:00", "title": "\u66f4\u771f\u5b9e\u81ea\u7136\u7684\u7ea2\u697c\u68a6: \u9edb\u7389\u4f20", "url": "/posts/geng-zhen-shi-zi-ran-de-hong-lou-meng-dai-yu-chuan/"}]}], "\u7535\u5f71": [1, "/categories/dian-ying/", {"posts": [{"date": "05/01/2016", "isodate": "2016-05-01T20:11:55+08:00", "title": "Hunger Games \u89c2\u540e\u611f", "url": "/posts/hunger-games-guan-hou-gan/"}]}], "\u7535\u89c6": [1, "/categories/dian-shi/", {"posts": [{"date": "07/09/2016", "isodate": "2016-07-09T19:23:43+08:00", "title": "\u66f4\u771f\u5b9e\u81ea\u7136\u7684\u7ea2\u697c\u68a6: \u9edb\u7389\u4f20", "url": "/posts/geng-zhen-shi-zi-ran-de-hong-lou-meng-dai-yu-chuan/"}]}], "\u91d1\u878d": [1, "/categories/jin-rong/", {"posts": [{"date": "06/15/2016", "isodate": "2016-06-15T15:09:52+08:00", "title": "\u6536\u7334\u5b50\u5356\u7334\u5b50\u7684\u6545\u4e8b(\u52a0\u5f3a\u7248)", "url": "/posts/shou-hou-zi-mai-hou-zi-de-gu-shi-jia-qiang-ban/"}]}]}